{
  "version": 1,
  "globSemantics": "ccd-routing-glob/v1",
  "trackedTopologySource": "git ls-files -z",
  "scopes": [
    {
      "id": "ai-governance",
      "description": "AI governance and protocol sources",
      "classification": "ai-governance",
      "consumers": ["rule-index", "skill-routing"],
      "effectiveGlobs": [".ai/**", "AGENTS.md", "CLAUDE.md"],
      "trackedMatchPolicy": "at-least-one-per-glob",
      "justification": "Current tracked topology and accepted P5 routing or rule lineage require this scope."
    },
    {
      "id": "ai-rules",
      "description": "Tracked AI rule lineage",
      "classification": "rule-lineage",
      "consumers": ["rule-index"],
      "effectiveGlobs": [".ai/rules/**"],
      "trackedMatchPolicy": "at-least-one-per-glob",
      "justification": "Current tracked topology and accepted P5 routing or rule lineage require this scope."
    },
    {
      "id": "app-adapters",
      "description": "Application runtime adapters",
      "classification": "adapter-subsystem",
      "consumers": ["rule-index"],
      "effectiveGlobs": ["apps/*/src/adapters/**"],
      "trackedMatchPolicy": "at-least-one-per-glob",
      "justification": "Current tracked topology and accepted P5 routing or rule lineage require this scope."
    },
    {
      "id": "app-api",
      "description": "Application API surfaces",
      "classification": "non-ui-subsystem",
      "consumers": ["rule-index"],
      "effectiveGlobs": ["apps/*/src/api/**"],
      "trackedMatchPolicy": "at-least-one-per-glob",
      "justification": "Current tracked topology and accepted P5 routing or rule lineage require this scope."
    },
    {
      "id": "app-constants",
      "description": "Application bootstrap constants",
      "classification": "bootstrap-subsystem",
      "consumers": ["rule-index"],
      "effectiveGlobs": ["apps/*/src/constants/**"],
      "trackedMatchPolicy": "at-least-one-per-glob",
      "justification": "Current tracked topology and accepted P5 routing or rule lineage require this scope."
    },
    {
      "id": "app-entrypoints",
      "description": "Application runtime entrypoints",
      "classification": "runtime-entrypoint",
      "consumers": ["rule-index"],
      "effectiveGlobs": ["apps/*/index.html", "apps/*/src/App.vue", "apps/*/src/main.ts"],
      "trackedMatchPolicy": "at-least-one-per-glob",
      "justification": "Current tracked topology and accepted P5 routing or rule lineage require this scope."
    },
    {
      "id": "app-hooks",
      "description": "Application hooks and composables",
      "classification": "composable-subsystem",
      "consumers": ["rule-index"],
      "effectiveGlobs": ["apps/*/src/hooks/**"],
      "trackedMatchPolicy": "at-least-one-per-glob",
      "justification": "Current tracked topology and accepted P5 routing or rule lineage require this scope."
    },
    {
      "id": "app-infra",
      "description": "Application infrastructure",
      "classification": "non-ui-subsystem",
      "consumers": ["rule-index"],
      "effectiveGlobs": ["apps/*/src/infra/**"],
      "trackedMatchPolicy": "at-least-one-per-glob",
      "justification": "Current tracked topology and accepted P5 routing or rule lineage require this scope."
    },
    {
      "id": "app-layouts",
      "description": "Application layouts",
      "classification": "ui-subsystem",
      "consumers": ["rule-index", "skill-routing"],
      "effectiveGlobs": ["apps/*/src/layouts/**"],
      "trackedMatchPolicy": "at-least-one-per-glob",
      "justification": "Current tracked topology and accepted P5 routing or rule lineage require this scope."
    },
    {
      "id": "app-routers",
      "description": "Application routers",
      "classification": "routing-subsystem",
      "consumers": ["rule-index", "skill-routing"],
      "effectiveGlobs": ["apps/*/src/router/**"],
      "trackedMatchPolicy": "at-least-one-per-glob",
      "justification": "Current tracked topology and accepted P5 routing or rule lineage require this scope."
    },
    {
      "id": "app-scss",
      "description": "Application SCSS sources",
      "classification": "style-source",
      "consumers": ["rule-index"],
      "effectiveGlobs": ["apps/*/src/**/*.scss"],
      "trackedMatchPolicy": "at-least-one-per-glob",
      "justification": "Current tracked topology and accepted P5 routing or rule lineage require this scope."
    },
    {
      "id": "app-stores",
      "description": "Application stores",
      "classification": "state-subsystem",
      "consumers": ["rule-index", "skill-routing"],
      "effectiveGlobs": ["apps/*/src/stores/**"],
      "trackedMatchPolicy": "at-least-one-per-glob",
      "justification": "Current tracked topology and accepted P5 routing or rule lineage require this scope."
    },
    {
      "id": "app-ts",
      "description": "Application TypeScript sources",
      "classification": "typescript-source",
      "consumers": ["rule-index"],
      "effectiveGlobs": ["apps/*/src/**/*.ts"],
      "trackedMatchPolicy": "at-least-one-per-glob",
      "justification": "Current tracked topology and accepted P5 routing or rule lineage require this scope."
    },
    {
      "id": "app-tsx",
      "description": "Application TSX sources",
      "classification": "typescript-source",
      "consumers": ["rule-index"],
      "effectiveGlobs": ["apps/*/src/**/*.tsx"],
      "trackedMatchPolicy": "at-least-one-per-glob",
      "justification": "Current tracked topology and accepted P5 routing or rule lineage require this scope."
    },
    {
      "id": "app-types",
      "description": "Application type declarations",
      "classification": "type-subsystem",
      "consumers": ["rule-index"],
      "effectiveGlobs": ["apps/*/src/types/**"],
      "trackedMatchPolicy": "at-least-one-per-glob",
      "justification": "Current tracked topology and accepted P5 routing or rule lineage require this scope."
    },
    {
      "id": "app-utils",
      "description": "Application utility sources",
      "classification": "utility-subsystem",
      "consumers": ["rule-index"],
      "effectiveGlobs": ["apps/*/src/utils/**"],
      "trackedMatchPolicy": "at-least-one-per-glob",
      "justification": "Current tracked topology and accepted P5 routing or rule lineage require this scope."
    },
    {
      "id": "app-views",
      "description": "Application views",
      "classification": "ui-subsystem",
      "consumers": ["rule-index", "skill-routing"],
      "effectiveGlobs": ["apps/*/src/views/**"],
      "trackedMatchPolicy": "at-least-one-per-glob",
      "justification": "Current tracked topology and accepted P5 routing or rule lineage require this scope."
    },
    {
      "id": "app-vite-configs",
      "description": "Application Vite configurations",
      "classification": "build-configuration",
      "consumers": ["rule-index", "skill-routing"],
      "effectiveGlobs": ["apps/*/vite.config.ts", "apps/vite.shared.ts"],
      "trackedMatchPolicy": "at-least-one-per-glob",
      "justification": "Current tracked topology and accepted P5 routing or rule lineage require this scope."
    },
    {
      "id": "app-vue",
      "description": "Application Vue sources",
      "classification": "ui-source",
      "consumers": ["rule-index", "skill-routing"],
      "effectiveGlobs": ["apps/*/src/**/*.vue"],
      "trackedMatchPolicy": "at-least-one-per-glob",
      "justification": "Current tracked topology and accepted P5 routing or rule lineage require this scope."
    },
    {
      "id": "design-tokens",
      "description": "Design token package",
      "classification": "design-system-package",
      "consumers": ["rule-index", "skill-routing"],
      "effectiveGlobs": ["packages/design-tokens/**"],
      "trackedMatchPolicy": "at-least-one-per-glob",
      "justification": "Current tracked topology and accepted P5 routing or rule lineage require this scope."
    },
    {
      "id": "desktop-governance-scripts",
      "description": "Desktop governance scripts",
      "classification": "governance-integration",
      "consumers": ["rule-index", "skill-routing"],
      "effectiveGlobs": ["scripts/drift-check.mjs", "scripts/sync-desktop-config.mjs"],
      "trackedMatchPolicy": "at-least-one-per-glob",
      "justification": "Current tracked topology and accepted P5 routing or rule lineage require this scope."
    },
    {
      "id": "desktop-source",
      "description": "Desktop application source",
      "classification": "runtime-specific",
      "consumers": ["rule-index", "skill-routing"],
      "effectiveGlobs": ["apps/desktop/src/**/*.ts", "apps/desktop/src/**/*.vue"],
      "trackedMatchPolicy": "at-least-one-per-glob",
      "justification": "Current tracked topology and accepted P5 routing or rule lineage require this scope."
    },
    {
      "id": "desktop-tauri",
      "description": "Tauri runtime source",
      "classification": "runtime-specific",
      "consumers": ["rule-index", "skill-routing"],
      "effectiveGlobs": ["apps/desktop/src-tauri/**"],
      "trackedMatchPolicy": "at-least-one-per-glob",
      "justification": "Current tracked topology and accepted P5 routing or rule lineage require this scope."
    },
    {
      "id": "e2e",
      "description": "End-to-end test surface",
      "classification": "test-surface",
      "consumers": ["rule-index", "skill-routing"],
      "effectiveGlobs": ["e2e/**", "playwright.config.ts"],
      "trackedMatchPolicy": "at-least-one-per-glob",
      "justification": "Current tracked topology and accepted P5 routing or rule lineage require this scope."
    },
    {
      "id": "github",
      "description": "GitHub governance surface",
      "classification": "remote-governance",
      "consumers": ["skill-routing"],
      "effectiveGlobs": [".github/**"],
      "trackedMatchPolicy": "at-least-one-per-glob",